{
  "catalogId": "tuvren.kernel.operations",
  "catalogVersion": "0.1.0",
  "packetId": "tuvren.kernel.protocol",
  "operations": [
    {
      "operationId": "kernel.store.put",
      "kind": "syscall",
      "capability": "kernel.protocol",
      "input": {
        "type": "object",
        "additionalProperties": false,
        "properties": {
          "blob": {
            "$ref": "https://tuvren.dev/schemas/conformance-observation-encoding.schema.json#/$defs/bytes"
          },
          "mediaType": {
            "$ref": "https://tuvren.dev/schemas/conformance-observation-encoding.schema.json#/$defs/identifier"
          }
        },
        "required": ["blob"]
      },
      "observation": {
        "result": {
          "$ref": "https://tuvren.dev/schemas/conformance-observation-encoding.schema.json#/$defs/hash"
        }
      },
      "errors": ["kernel_persistence_fault_injected"],
      "handles": {
        "consumes": ["instance"]
      },
      "binding": "typescript/kernel/protocol#RuntimeKernel.store.put"
    },
    {
      "operationId": "kernel.store.get",
      "kind": "syscall",
      "capability": "kernel.protocol",
      "input": {
        "type": "object",
        "additionalProperties": false,
        "properties": {
          "hash": {
            "$ref": "https://tuvren.dev/schemas/conformance-observation-encoding.schema.json#/$defs/hash"
          }
        },
        "required": ["hash"]
      },
      "observation": {
        "result": {
          "anyOf": [
            {
              "$ref": "https://tuvren.dev/schemas/conformance-observation-encoding.schema.json#/$defs/bytes"
            },
            {
              "type": "null"
            }
          ]
        }
      },
      "errors": [],
      "handles": {
        "consumes": ["instance"]
      },
      "binding": "typescript/kernel/protocol#RuntimeKernel.store.get"
    },
    {
      "operationId": "kernel.store.has",
      "kind": "syscall",
      "capability": "kernel.protocol",
      "input": {
        "type": "object",
        "additionalProperties": false,
        "properties": {
          "hash": {
            "$ref": "https://tuvren.dev/schemas/conformance-observation-encoding.schema.json#/$defs/hash"
          }
        },
        "required": ["hash"]
      },
      "observation": {
        "result": {
          "type": "boolean"
        }
      },
      "errors": [],
      "handles": {
        "consumes": ["instance"]
      },
      "binding": "typescript/kernel/protocol#RuntimeKernel.store.has"
    },
    {
      "operationId": "kernel.schema.register",
      "kind": "syscall",
      "capability": "kernel.protocol",
      "input": {
        "type": "object",
        "additionalProperties": false,
        "properties": {
          "schema": {
            "type": "object",
            "additionalProperties": false,
            "properties": {
              "schemaId": {
                "$ref": "https://tuvren.dev/schemas/conformance-observation-encoding.schema.json#/$defs/identifier"
              },
              "paths": {
                "type": "array",
                "items": {
                  "type": "object",
                  "additionalProperties": false,
                  "properties": {
                    "path": {
                      "$ref": "https://tuvren.dev/schemas/conformance-observation-encoding.schema.json#/$defs/identifier"
                    },
                    "collection": {
                      "enum": ["ordered", "single"]
                    },
                    "metadata": {
                      "$ref": "https://tuvren.dev/schemas/conformance-observation-encoding.schema.json#/$defs/record"
                    }
                  },
                  "required": ["path", "collection"]
                }
              },
              "incorporationRules": {
                "type": "array",
                "items": {
                  "type": "object",
                  "additionalProperties": false,
                  "properties": {
                    "objectType": {
                      "$ref": "https://tuvren.dev/schemas/conformance-observation-encoding.schema.json#/$defs/identifier"
                    },
                    "targetPath": {
                      "$ref": "https://tuvren.dev/schemas/conformance-observation-encoding.schema.json#/$defs/identifier"
                    }
                  },
                  "required": ["objectType", "targetPath"]
                }
              }
            },
            "required": ["schemaId", "paths", "incorporationRules"]
          }
        },
        "required": ["schema"]
      },
      "observation": {
        "result": {
          "$ref": "https://tuvren.dev/schemas/conformance-observation-encoding.schema.json#/$defs/identifier"
        }
      },
      "errors": ["duplicate_schema_path", "kernel_persistence_fault_injected"],
      "handles": {
        "consumes": ["instance"]
      },
      "binding": "typescript/kernel/protocol#RuntimeKernel.schema.register"
    },
    {
      "operationId": "kernel.schema.get",
      "kind": "syscall",
      "capability": "kernel.protocol",
      "input": {
        "type": "object",
        "additionalProperties": false,
        "properties": {
          "schemaId": {
            "$ref": "https://tuvren.dev/schemas/conformance-observation-encoding.schema.json#/$defs/identifier"
          }
        },
        "required": ["schemaId"]
      },
      "observation": {
        "result": {
          "anyOf": [
            {
              "type": "object",
              "additionalProperties": false,
              "properties": {
                "schemaId": {
                  "$ref": "https://tuvren.dev/schemas/conformance-observation-encoding.schema.json#/$defs/identifier"
                },
                "paths": {
                  "type": "array",
                  "items": {
                    "type": "object",
                    "additionalProperties": false,
                    "properties": {
                      "path": {
                        "$ref": "https://tuvren.dev/schemas/conformance-observation-encoding.schema.json#/$defs/identifier"
                      },
                      "collection": {
                        "enum": ["ordered", "single"]
                      },
                      "metadata": {
                        "$ref": "https://tuvren.dev/schemas/conformance-observation-encoding.schema.json#/$defs/record"
                      }
                    },
                    "required": ["path", "collection"]
                  }
                },
                "incorporationRules": {
                  "type": "array",
                  "items": {
                    "type": "object",
                    "additionalProperties": false,
                    "properties": {
                      "objectType": {
                        "$ref": "https://tuvren.dev/schemas/conformance-observation-encoding.schema.json#/$defs/identifier"
                      },
                      "targetPath": {
                        "$ref": "https://tuvren.dev/schemas/conformance-observation-encoding.schema.json#/$defs/identifier"
                      }
                    },
                    "required": ["objectType", "targetPath"]
                  }
                }
              },
              "required": ["schemaId", "paths", "incorporationRules"]
            },
            {
              "type": "null"
            }
          ]
        }
      },
      "errors": [],
      "handles": {
        "consumes": ["instance"]
      },
      "binding": "typescript/kernel/protocol#RuntimeKernel.schema.get"
    },
    {
      "operationId": "kernel.tree.create",
      "kind": "syscall",
      "capability": "kernel.protocol",
      "input": {
        "type": "object",
        "additionalProperties": false,
        "properties": {
          "schemaId": {
            "$ref": "https://tuvren.dev/schemas/conformance-observation-encoding.schema.json#/$defs/identifier"
          },
          "changes": {
            "type": "object",
            "additionalProperties": false,
            "properties": {
              "$map": {
                "type": "array",
                "items": {
                  "type": "array",
                  "prefixItems": [
                    {
                      "$ref": "https://tuvren.dev/schemas/conformance-observation-encoding.schema.json#/$defs/identifier"
                    },
                    {
                      "anyOf": [
                        {
                          "$ref": "https://tuvren.dev/schemas/conformance-observation-encoding.schema.json#/$defs/hash"
                        },
                        {
                          "type": "array",
                          "items": {
                            "$ref": "https://tuvren.dev/schemas/conformance-observation-encoding.schema.json#/$defs/hash"
                          }
                        },
                        {
                          "type": "null"
                        }
                      ]
                    }
                  ],
                  "items": false,
                  "minItems": 2,
                  "maxItems": 2
                }
              }
            },
            "required": ["$map"]
          },
          "baseTurnTreeHash": {
            "$ref": "https://tuvren.dev/schemas/conformance-observation-encoding.schema.json#/$defs/hash"
          }
        },
        "required": ["schemaId", "changes"]
      },
      "observation": {
        "result": {
          "$ref": "https://tuvren.dev/schemas/conformance-observation-encoding.schema.json#/$defs/hash"
        }
      },
      "errors": [
        "kernel_runtime_missing_required_tree_path",
        "kernel_persistence_fault_injected"
      ],
      "handles": {
        "consumes": ["instance"]
      },